{
  "schemaVersion": "1.0",
  "artifactType": "readiness-authorization",
  "planId": "sha256:d996144108d960abf0e17c751c2d9dfdd40f5ded3a0b42a682266579443f5693",
  "scenarioSlug": "fast-006-fraud-investigation-fully-custom",
  "decisionId": "sha256:bd498fe625b6cfa9ad5f8b0e88dfdf0a8f9a7e84d248efee2282af19532f67de",
  "architecture": "fully-custom",
  "dryRun": true,
  "items": [
    {
      "requiredForArchitecture": false,
      "environmentUrl": "",
      "metadataFingerprint": "",
      "gateOpen": false,
      "status": "not-required",
      "fresh": false,
      "snapshotMatch": false,
      "packageMatch": false,
      "limitations": []
    },
    {
      "requirements": [
        "FAST-006 produces dry-run plans only; a later phase must explicitly authorize build-stage integration.",
        "Revalidate the approved decision and all input fingerprints immediately before any future execution."
      ],
      "executionAuthorized": false
    }
  ]
}
